Step,Action
1.0,Fully read and understand the drive user guide as well as the user guide for the module
,prior to installing the module.
2.0,Verify that the order number on the nameplate of the module corresponds to the
,specification in the manual for the module.
3.0,"Note and record the serial number, revision and DOM shown on the nameplate of the"
,module and the nameplate of the device.
4.0,Remove the cover from the module slot and keep the cover.
5.0,Inspect the module for visible damage. Do not install damaged modules.
6.0,Push the module into the appropriate slot until the snap-in lock snaps in.
